X,Y,OBJECTID,Name,Address,PhoneNumber,Website,Facebook,Twitter,SportsHall,Hall,Stage,MeetingRooms,Wifi,CoffeeDock,ITFacilities,ChildcareCreche,Parking,DisabilityAccess,OutDoorFacilities,PlayArea,SummaryActivities,Creator,CreationDate,Editor,EditorDate,SDCCOwned,PrimaryActivity,Email
-6.364511335801723,53.32058884719531,4807,BLUEBELL UTD AFC LTD.,"CARPO PARK, NAAS ROAD, DUBLIN 22",+353,http://,http://www.facebook.com/,@,,,,,,,,,,,,,ACTIVITIES OF SPORT CLUBS,COMMUNITY,2015-06-15T15:39:47.000Z,COMMUNITY,2015-10-13T14:25:59.000Z,,Sports and Recreation Clubs,
-6.331999560234681,53.309707686873743,4810,GREENHILLS BOYS FOOTBALL CLUB,"SAINT JOSEPH'S ROAD, DUBLIN 12",,http://www.gbfc.ie/,,,,,,,,,,,,,,,"Football, soccer",COMMUNITY,2015-06-15T15:39:47.000Z,Esri_Anonymous,2016-04-29T14:34:18.000Z,,Sports and Recreation Clubs,
-6.311916743615162,53.302662030273339,4811,SAINT MARY'S RUGBY FOOTBALL CLUB,"TEMPLEVILLE ROAD, DUBLIN 6W",,http://www.stmaryscollegerfc.com/,,,,,,,,,,,,,,,"Rugby, fitness,",COMMUNITY,2015-06-15T15:39:47.000Z,Esri_Anonymous,2016-04-27T10:48:34.000Z,No,Sports and Recreation Clubs,
-6.284644141739233,53.299550265949854,4813,RATHFARNHAM W. S. A. F. ATHLETIC CLUB,"59 MAIN STREET, RATHFARNHAM, DUBLIN 14",,http://www.athleticsrathfarnham.ie,,,,,,Yes,,,,,No,,,,"Athletics, running, fitness",COMMUNITY,2015-06-15T15:39:47.000Z,Esri_Anonymous,2016-04-27T10:11:16.000Z,Yes,Sports and Recreation Clubs,
-6.322374102028048,53.311122641642768,4814,ROBERT EMMET'S GAA Club,"LIMEKILN LANE, PERRYSTOWN, DUBLIN 12",,http://mygaa.club/clubs/robertemmetsgaa,,,,,No,,,,,,,,Yes,,GAA Sports,COMMUNITY,2015-06-15T15:39:47.000Z,Esri_Anonymous,2015-10-13T16:10:24.000Z,,Sports and Recreation Clubs,
-6.321688281097207,53.311126093010046,4815,MANORTOWN F.C.,"LIMEKILN LANE, PERRYSTOWN, DUBLIN 12",,http://www.manortownunited.com/,,,,,,,,,,,,,,,ACTIVITIES OF SPORT CLUBS,COMMUNITY,2015-06-15T15:39:47.000Z,COMMUNITY,2015-10-13T14:25:59.000Z,,Sports and Recreation Clubs,
-6.354840897276416,53.284958766235405,4818,SAINT MARY'S BOXING CLUB,"SAINT DOMINIC'S ROAD, DUBLIN 24",,,,,,,,,,,,,,,,,ACTIVITIES OF SPORT CLUBS,COMMUNITY,2015-06-15T15:39:47.000Z,COMMUNITY,2015-10-13T14:25:59.000Z,,Sports and Recreation Clubs,
-6.30392084456788,53.298010631323329,4820,TEMPLEOGUE TENNIS CLUB,"192/194 TEMPLEOGUE ROAD, DUBLIN 6W",+353,http://www.templeoguetennis.com/,,,,,,,,,,,,,,,Tennis Club,COMMUNITY,2015-06-15T15:39:47.000Z,Esri_Anonymous,2015-10-12T12:57:15.000Z,,Sports and Recreation Clubs,
-6.316718853439526,53.289318356209812,4821,BALLYBODEN SAINT ENDA'S GAA CLUB,"FIRHOUSE ROAD, DUBLIN 16",+353 1 494 7950,http://www.bodengaa.ie/,,,,Yes,Yes,,,Yes,,,Yes,,Yes,,GAA Club and related activities,COMMUNITY,2015-06-15T15:39:47.000Z,Esri_Anonymous,2015-10-13T16:09:43.000Z,No,Sports and Recreation Clubs,
-6.315746124457669,53.296088893748966,4822,Templeogue Castle Community Bridge Club,"TEMPLEOGUE HOUSE, TEMPLEOGUE ROAD, DUBLIN 6W",+353 1 406 3707 (occasional),http://www.tccbc.ie/,,,,,,,,,,,,,,,Bridge,COMMUNITY,2015-06-15T15:39:47.000Z,Esri_Anonymous,2016-02-26T13:19:44.000Z,,Sports and Recreation Clubs,
-6.327771594963641,53.296670147399624,4824,NAOMH JUDE GAA Saint Jude,"WELLINGTON LANE, DUBLIN 6W",490 5255,http://www.stjudesgaa.ie/,,@,,Yes,,Yes,,Yes,,,Yes,,Yes,,GAA Club,COMMUNITY,2015-06-15T15:39:47.000Z,Esri_Anonymous,2015-10-12T12:58:10.000Z,No,Sports and Recreation Clubs,
-6.3290028028589,53.297104606340113,4825,TEMPLEOGUE UNITED,"WELLINGTON LANE, DUBLIN 6W",,http://www.templeogueunited.com/,,,,,,,,,,,,,,,ACTIVITIES OF SPORT CLUBS,COMMUNITY,2015-06-15T15:39:47.000Z,Esri_Anonymous,2015-10-12T12:58:25.000Z,,Sports and Recreation Clubs,
-6.272810971334354,53.279655274801058,4828,THREE ROCK ROVERS,"MARLEY PARK, GRANGE ROAD, DUBLIN 16",,http://www.threerockrovershc.com/,,,,,,,,,,,,,,,Hockey Club,COMMUNITY,2015-06-15T15:39:47.000Z,Esri_Anonymous,2015-10-12T13:12:50.000Z,,Sports and Recreation Clubs,
-6.362256735098017,53.295922283492146,4831,PHOENIX GYMNASTICS CLUB,"UNIT 1, BROOMHILL TERRACE, DUBLIN 24",296 1428,http://www.phoenixgymnastics.ie/,,,,,,,,,,,,,,,Gymnastic Club sports,COMMUNITY,2015-06-15T15:39:47.000Z,Esri_Anonymous,2015-10-12T15:39:52.000Z,,Sports and Recreation Clubs,
-6.363184155319735,53.356302337497702,4834,PALMERSTOWN RANGERS SPORTS & LEISURE LTD.,"MILL LANE, DUBLIN 20",+353,http://palmerstownrangersfc.50webs.com/index.html,,,,,,,,,,,,,,,OPERATION OF SPORTS FACILITIES,COMMUNITY,2015-06-15T15:39:47.000Z,Esri_Anonymous,2015-10-12T14:15:15.000Z,,Sports and Recreation Clubs,
-6.291361302721433,53.273970714577224,4835,EDMONDSTOWN GOLF COURSE,"EDMONDSTOWN ROAD, DUBLIN 16",+353 1 493 1082,http://www.edmondstowngolfclub.ie,,@,,,,Yes,,Yes,,,Yes,,Yes,,OPERATION OF SPORTS FACILITIES,COMMUNITY,2015-06-15T15:39:47.000Z,Esri_Anonymous,2016-04-27T10:51:39.000Z,,Sports and Recreation Clubs,
-6.39566927895654,53.318141452718329,4836,ROUND TOWERS GAA,"CONVENT ROAD, DUBLIN 22",+353 1 4592960,http://roundtower.ie/,,,,,,,,,,,,,,,GAA  SPORT CLUB,COMMUNITY,2015-06-15T15:39:47.000Z,Esri_Anonymous,2015-10-13T16:10:52.000Z,,Sports and Recreation Clubs,
-6.473959714965887,53.351893209625864,4838,LUCAN GOLF CLUB,"CELBRIDGE ROAD, LUCAN, CO. DUBLIN",(01) 628 0246,http://www.lucangolfclub.ie/,,,,,,,,,,,,,,,Golf Club,COMMUNITY,2015-06-15T15:39:47.000Z,Esri_Anonymous,2016-01-05T17:13:46.000Z,,Sports and Recreation Clubs,
-6.388381988607999,53.289667454227668,4840,SAINT MARK'S GAA CLUB,"MCGEE PARK, COOKSTOWN ROAD, DUBLIN 24",+353 1 452 1609,http://www.stmarksgaa.ie/,,,,,,,,,,,,,,,GAA Football Club,COMMUNITY,2015-06-15T15:39:47.000Z,Esri_Anonymous,2016-04-27T11:05:13.000Z,,Sports and Recreation Clubs,
-6.390865088090318,53.286235844451795,4841,MARK'S CELTIC FOOTBALL CLUB,"MAPLEWOOD ROAD, DUBLIN 24",,http://www.markscelticfc.com/,,,,,,,,,,,,,,,"Soccer, football, fitness",COMMUNITY,2015-06-15T15:39:47.000Z,Esri_Anonymous,2016-04-29T14:47:41.000Z,,Sports and Recreation Clubs,
-6.361389361831665,53.272564009393541,4842,Thomas Davis GAA Club,"THOMAS DAVIS G.A.A CLUB, KILTIPPER ROAD, DUBLIN 24",,http://www.thomasdavisgaa.ie,,,,Yes,,Yes,,Yes,,,Yes,Yes,,,GAA Sports,COMMUNITY,2015-06-15T15:39:47.000Z,COMMUNITY,2016-03-10T17:02:48.000Z,,Sports and Recreation Clubs,
-6.36172449259624,53.271553123472771,4843,GLENVILLE PITCH AND PUTT COURSE,"KILTIPPER ROAD, DUBLIN 24",(01) 4519916,http://www.glenvillepitchandputtclub.com/,,,,,,,,,,,,,,,Pitch and Putt,COMMUNITY,2015-06-15T15:39:47.000Z,Esri_Anonymous,2016-01-05T16:36:02.000Z,No,Sports and Recreation Clubs,glenvillepnp@gmail.com
-6.356356093506291,53.269765831961855,4844,Saint Anne's GAA Club,"SAINT ANNE'S G.A.A. CLUB, BOHERNABREENA ROAD, BOHERNABREENA, CO. DUBLIN",451 0372,http://www.stannesgaa.com,,,,Yes,,,,Yes,,,Yes,,,,GAA Club Sports,COMMUNITY,2015-06-15T15:39:47.000Z,COMMUNITY,2016-03-10T17:02:48.000Z,,Sports and Recreation Clubs,
-6.46144659226351,53.284443201534145,4849,COMMERCIALS GAA CLUB,"COLLEGE LANE, NEWCASTLE ROAD, RATHCOOLE, CO. DUBLIN",+353,http://www.commercialshurlingclub.gaa.ie,,,,,,,,,,,,,Yes,,GAA Club - Hurling Club,COMMUNITY,2015-06-15T15:39:47.000Z,Esri_Anonymous,2015-10-13T13:54:55.000Z,No,Sports and Recreation Clubs,
-6.442256283230098,53.279447388914413,4850,St. Marys GAA Club,"SAINT MARY'S G.A.A. CLUB, PÁIRC MHUIRE, SAGGART, CO. DUBLIN",4589099,http://www.stmaryssaggart.com/,,,,Yes,,Yes,,Yes,,,Yes,,Yes,,GAA Club Sports,COMMUNITY,2015-06-15T15:39:47.000Z,Esri_Anonymous,2015-10-13T16:11:54.000Z,,Sports and Recreation Clubs,
-6.308162183352144,53.269040789696518,4854,RATHFARNHAM GOLF CLUB,"STOCKING LANE, DUBLIN 16",+3531 493 1201,http://www.rathfarnhamgolfclub.ie,,,,,,Yes,,Yes,,,,,,,Golf,COMMUNITY,2015-06-15T15:39:47.000Z,Esri_Anonymous,2016-04-27T10:23:34.000Z,,Sports and Recreation Clubs,
-6.471171039811185,53.256478643146323,4855,SLADE VALLEY GOLF CLUB,"SLADEVALLEY, BRITTAS, DUBLIN 24",(01) 458 2183,http://www.sladevalleygolfclub.ie/,,,,,,,,,,,,,,,Golf Club,COMMUNITY,2015-06-15T15:39:47.000Z,Esri_Anonymous,2016-01-06T16:31:52.000Z,,Sports and Recreation Clubs,
-6.472900103618506,53.320820150907309,4856,NEWCASTLE GOLF CENTRE,"PEAMOUNT LANE, NEWCASTLE, CO. DUBLIN",01 6210201,http://www.newcastlegolfcentredublin.com/,,,,,,,,,,,,,,,GOLF CENTRE,COMMUNITY,2015-06-15T15:39:47.000Z,Esri_Anonymous,2016-01-06T15:34:49.000Z,,Sports and Recreation Clubs,
-6.455494671858389,53.331500273428432,4858,LUCAN PITCH & PUTT,"12TH LOCK NEWCASTLE ROAD, LUCAN, CO. DUBLIN",01 6281570,http://www.lucanpitchandputt.com/,,,,,,,,,,,,,,,OPERATION OF SPORTS FACILITIES,COMMUNITY,2015-06-15T15:39:47.000Z,Esri_Anonymous,2016-01-05T17:15:45.000Z,,Sports and Recreation Clubs,
-6.473044113055378,53.277857891730577,4859,RATHCOOLE BOY'S FOOTBALL CLUB,"MAIN ROAD, FOREST HILLS, RATHCOOLE, CO. DUBLIN",,http://www.rathcooleboysfc.com/,,,,,,,,,,,,,,,Football Soccer,COMMUNITY,2015-06-15T15:39:47.000Z,Esri_Anonymous,2016-04-29T14:35:06.000Z,,Sports and Recreation Clubs,
-6.362244104378481,53.263524400929256,4861,BOHERNABREENA PITCH AND PUTT,"BOHERNABREENA, CO. DUBLIN",0876241944,http://www.bohernabreenapitchandputt.com,https://www.facebook.com/Bohernabreena-Pitch-and-Putt-154071587948341/,,,,,,,,,,,,,,"Pitch and Putt, Golf",COMMUNITY,2015-06-15T15:39:47.000Z,Esri_Anonymous,2016-04-27T11:22:54.000Z,,Sports and Recreation Clubs,
-6.376160923899659,53.250382277754802,4862,fOOTEE,"BALLINASCORNEY LOWER, CO. DUBLIN",0873952548,http://footee.ie/,,,,,,,,,,,,,,,Football,COMMUNITY,2015-06-15T15:39:47.000Z,Esri_Anonymous,2016-04-27T10:28:25.000Z,No,Sports and Recreation Clubs,
-6.428185017028921,53.303346614402251,4863,SAINT FRANCIS FOOTBALL CLUB,"BALDONNELL LOWER, CLONDALKIN, DUBLIN 22",,http://www.stfrancisfcseniors.com/,,,,,,,,,,,,,,,ACTIVITIES OF SPORT CLUBS,COMMUNITY,2015-06-15T15:39:47.000Z,COMMUNITY,2015-10-13T14:25:59.000Z,,Sports and Recreation Clubs,
-6.391883852758097,53.308591128255451,4864,NEWLANDS GOLF CLUB,"BELGARD ROAD, DUBLIN 22",353 1 459 3157,http://www.newlandsgolfclub.com/,,,,,,,,,,,,,,,GOLF CLUB,COMMUNITY,2015-06-15T15:39:47.000Z,Esri_Anonymous,2016-01-06T15:36:18.000Z,,Sports and Recreation Clubs,
-6.417831424486026,53.299509716724742,4867,CLONDALKIN RUGBY FOOTBALL CLUB,"GORDON PARK, KINGSWOOD CROSS, DUBLIN 22",,http://clondalkinrugby.com/pages/,,,,,,,,,,,,,,,RUGBY SPORT CLUBS,COMMUNITY,2015-06-15T15:39:47.000Z,Esri_Anonymous,2015-10-13T16:24:13.000Z,,Sports and Recreation Clubs,
-6.302416748559251,53.260785003159931,4868,WANDERERS G.A.A. CLUB,"Frank Kelly Park, MOUNT VENUS ROAD, DUBLIN 16",,http://www.wanderersgaa.ie/,,,,Yes,,Yes,,,,,,,Yes,,GAA Club,COMMUNITY,2015-06-15T15:39:47.000Z,Esri_Anonymous,2015-10-12T13:21:32.000Z,No,Sports and Recreation Clubs,
-6.411637646433025,53.363356023859573,4872,HERMITAGE GOLF CLUB,"LUCAN, CO. DUBLIN",353 (0)1 6268491,http://www.hermitagegolf.ie/,,,,,,,,,,,,,,,Golf Club,COMMUNITY,2015-06-15T15:39:47.000Z,Esri_Anonymous,2016-01-05T16:51:31.000Z,,Sports and Recreation Clubs,
-6.4582961439706,53.331689015342519,4873,LUCAN SARSFIELDS GAA,"NEWCASTLE ROAD, LUCAN, CO. DUBLIN",,http://www.lucansarsfields.ie/,,,,Yes,,Yes,,Yes,,,,,Yes,,GAA Club Sports,COMMUNITY,2015-06-15T15:39:47.000Z,COMMUNITY,2016-03-10T17:02:48.000Z,No,Sports and Recreation Clubs,
-6.47423084146086,53.361484897611533,4875,LIFFEY VALLEY PAR THREE,"LUCAN ROAD, LEIXLIP, CO. DUBLIN",01-6219514,http://liffeyvalleypar3golf.com/,,,,,,,,,,,,,,,Golf,COMMUNITY,2015-06-15T15:39:47.000Z,Esri_Anonymous,2016-01-05T16:57:44.000Z,,Sports and Recreation Clubs,clubhouse@liffeyvalleypar3golf.com
-6.404283361047195,53.273162696990958,4877,HAZELGROVE GOLF CLUB,"KILTALOWN, TALLAGHT, DUBLIN 24",01 452 0911,http://www.hazelgrove.ie/,,,,,,,,,,,,,,,Golf,COMMUNITY,2015-06-15T15:39:47.000Z,Esri_Anonymous,2016-01-05T16:49:26.000Z,No,Sports and Recreation Clubs,hazlegrovegolfclub@gmail.com
-6.48593005853237,53.302044949306897,4881,SAINT FINIAN'S GAA CLUB,"AYLMER ROAD, NEWCASTLE, CO. DUBLIN",,http://www.stfiniansnewcastle.ie/,,,,,,,,,,,,,,,GAA Sport Fitness,COMMUNITY,2015-06-15T15:39:47.000Z,Esri_Anonymous,2016-04-27T11:03:36.000Z,,Sports and Recreation Clubs,
-6.470418187262495,53.265356006114693,4883,SAGGART PITCH AND PUTT,"COOLMINE, SAGGART, CO. DUBLIN",353 (01) 4589591,http://saggartpitchandputt.com/,,,,,,,,,,,,,,,ACTIVITIES OF SPORT CLUBS,COMMUNITY,2015-06-15T15:39:47.000Z,Esri_Anonymous,2016-01-05T16:15:12.000Z,,Sports and Recreation Clubs,
-6.418424708806182,53.309993011314866,4887,CORKAGH PARK FISHING CLUB,"CORKAGH DEMESNE, DUBLIN 22",4592625,http://corkaghparkfishery.blogspot.ie/2011/01/welcome-to-corkagh-park-fishery.htm,,,,,,,,,,,,,,,ACTIVITIES OF SPORT CLUBS,COMMUNITY,2015-06-15T15:39:47.000Z,COMMUNITY,2015-10-13T14:25:59.000Z,,Sports and Recreation Clubs,
-6.438781007483607,53.233696166332749,4890,DUBLIN MOUNTAIN GOLF CLUB,"BRITTAS, CO. DUBLIN",014582622,http://www.dublinmountaingolf.com/,,,,,,,,,,,,,,,Golf,COMMUNITY,2015-06-15T15:39:47.000Z,Esri_Anonymous,2016-01-05T16:28:14.000Z,,Sports and Recreation Clubs,
-6.468398825896418,53.349767611420248,4892,LUCAN UNITED SOCCER CLUB,"LUCAN UNITED CLUBHOUSE, AIRLIE HEIGHTS, LUCAN, CO. DUBLIN",,http://www.lucanunitedfc.yourclub.ie/,,,,,,,,,,,,,,,"Football, Soccer, Sports",COMMUNITY,2015-06-15T15:39:47.000Z,Esri_Anonymous,2016-04-29T14:37:30.000Z,,Sports and Recreation Clubs,
-6.339236337999467,53.287453654013575,4902,EMERALD WARRIORS FOOTBALL CLUB,"UNIT 3, BOLBROOK ENTERPRISE CENTRE, AVONMORE ROAD, DUBLIN 24",+353,http://,http://www.facebook.com/,@,,,,,,,,,,,,,ACTIVITIES OF SPORT CLUBS,COMMUNITY,2015-06-15T15:39:47.000Z,COMMUNITY,2015-10-13T14:25:59.000Z,,Sports and Recreation Clubs,
-6.356301448080985,53.291072447855242,4912,MAELRUANS FOOTBALL CLUB,"GREENHILLS ROAD, DUBLIN 24",,,,,,,,,,,,,,,,,Soccer Club Sports,COMMUNITY,2015-06-15T15:39:47.000Z,Esri_Anonymous,2015-10-12T15:32:41.000Z,,Sports and Recreation Clubs,
-6.356264129759116,53.291172827149467,4913,TALLAGHT ATHLETIC CLUB,"GREENHILLS ROAD, DUBLIN 24",4514844,http://www.tallaghtac.ie/,,,,,,,,,,,,,,,Athlethics Club Sports,COMMUNITY,2015-06-15T15:39:47.000Z,Esri_Anonymous,2015-10-12T11:30:07.000Z,,Sports and Recreation Clubs,
-6.376557448879002,53.293766017961723,4915,KILNAMANAGH BOXING CLUB,"UNIT 42, THIRD AVENUE, COOKSTOWN INDUSTRIAL ESTATE, DUBLIN 24",,,https://www.facebook.com/kilnamanagh.boxingclub,,,,,,,,,,,,,,Boxing Club,COMMUNITY,2015-06-15T15:39:47.000Z,Esri_Anonymous,2015-10-12T15:48:05.000Z,,Sports and Recreation Clubs,
-6.340200862397131,53.27621938845693,4918,FIRHOUSE CARMEL FOOTBALL CLUB,"BALLYCULLEN DRIVE, DUBLIN 24",,http://www.firhousecarmel.com,,,,,,,,,,,,,,,ACTIVITIES OF SPORT CLUBS,COMMUNITY,2015-06-15T15:39:47.000Z,COMMUNITY,2016-03-10T17:02:48.000Z,,Sports and Recreation Clubs,
-6.326251596475095,53.283941694017692,4919,MODEL RAILWAY CLUB,"OLD KNOCKLYON ROAD, DUBLIN 16",,sdmrc.hobbysites.net,,@,,,,,,,,,,,,,Model Railway Community Club,COMMUNITY,2015-06-15T15:39:47.000Z,Esri_Anonymous,2015-10-13T16:13:10.000Z,,Sports and Recreation Clubs,
-6.297152827200708,53.280551279286975,4920,SAINT JOSEPH'S AMATURE BOXING CLUB,"BALLYBODEN ROAD, DUBLIN 16",,http://www.stjosephsboxing.com,www.facebook.com/stjosephsboxing,,,Yes,,,,,,,,,,,Boxing Club,COMMUNITY,2015-06-15T15:39:47.000Z,Esri_Anonymous,2015-10-13T16:20:52.000Z,,Sports and Recreation Clubs,
-6.285967197273732,53.292578550526734,4922,LORETO HOCKEY CLUB,"LORETO HIGH SCHOOL, GRANGE ROAD, DUBLIN 14",+353,http://www.loretohockeyclub.ie/,,,,,,,,,,,,,,,ACTIVITIES OF SPORT CLUBS,COMMUNITY,2015-06-15T15:39:47.000Z,Esri_Anonymous,2015-10-12T13:44:52.000Z,,Sports and Recreation Clubs,
-6.282930705959711,53.280754767701488,4925,GRANGE GOLF CLUB,"WHITECHURCH ROAD, DUBLIN 16",+353 1 493 2889,http://www.grangegolfclub.ie/,,,,,,,,,,,,,,,Golf Club,COMMUNITY,2015-06-15T15:39:47.000Z,Esri_Anonymous,2016-04-27T10:52:18.000Z,No,Sports and Recreation Clubs,
-6.326414185958339,53.277529678865264,4926,KNOCKLYON UNITED FOOTBALL CLUB,"GLENLYON PARK, DUBLIN 16",,http://www.knocklyonunitedfc.yourclub.ie/,,,,,,,,,,,,,,,ACTIVITIES OF SPORT CLUBS,COMMUNITY,2015-06-15T15:39:47.000Z,COMMUNITY,2015-10-13T14:25:59.000Z,,Sports and Recreation Clubs,
-6.339525778734047,53.287175890400626,5325,TALLAGHT WARRIORS RUGBY YOUTH CLUB,"BOLBROOK ENTERPRISE CENTRE, AVONMORE ROAD, DUBLIN 24",+353,http://,http://www.facebook.com/,@,,,,,,,,,,,,,Rugby Sports,COMMUNITY,2015-06-15T15:46:10.000Z,Esri_Anonymous,2015-10-13T16:16:57.000Z,,Sports and Recreation Clubs,
-6.302605121741937,53.283166274793075,6808,Ballyboden St. Endas GAA,Sancta Maria,01 494 7950,http://www.bodengaa.ie,,@,,,,,,,,,Yes,,Yes,,GAA Pitches and All Weather Facilities,Esri_Anonymous,2015-09-14T16:10:29.000Z,Esri_Anonymous,2015-10-09T13:24:33.000Z,No,Sports and Recreation Clubs,
-6.394055578146621,53.293435514017027,10407,FETTERCAIRN HORSE PROJECT,"Fettercairn Road, Tallaght, Dublin 24",462 7214,http://fyhp.ie/,na,na,,,,,,,,,,,Yes,,Horse Project,Esri_Anonymous,2015-10-06T14:10:22.000Z,Esri_Anonymous,2015-10-12T15:52:09.000Z,Yes,Sports and Recreation Clubs,
-6.35178126612061,53.304205698757706,10806,Kilnamanagh Football Club,"Treepark Road, Kilnamanagh, Dublin 24",,http://www.kafc.ie/,,,,,,,,,,,,,,,Football Club,Esri_Anonymous,2015-10-07T10:42:08.000Z,Esri_Anonymous,2015-10-12T15:36:51.000Z,,Sports and Recreation Clubs,
-6.461208345276439,53.356109410611374,14808,Clondalkin Canoe Facility,South County Dublin Leisure Services,,,,@,,,,,,,,,,,,,Canoeing,Esri_Anonymous,2015-10-22T09:50:11.000Z,Esri_Anonymous,2015-10-22T09:51:30.000Z,Yes,Sports and Recreation Clubs,
-6.449422337517224,53.346925266681922,14809,Lucan Harriers Athletic CLub,"Newcastle Road,  Lucan,  Co Dublin",,http://www.lucanharriers.com/,,,,,,,,,,,,,,,Athletics Fitness Sport,Esri_Anonymous,2015-10-22T09:56:04.000Z,Esri_Anonymous,2016-05-03T16:02:13.000Z,,Sports and Recreation Clubs,
-6.41541576112598,53.354459590046432,14810,Esker Celtic Football Club,"Griffeen Park, Lucan, Co. Dublin",,http://eskerceltic.ie/,,,,,,,,,,,,,,,"Soccer, Football, Fitness",Esri_Anonymous,2015-10-22T09:57:01.000Z,Esri_Anonymous,2016-05-03T15:54:28.000Z,,Sports and Recreation Clubs,
-6.355804222073157,53.292727792216233,16010,Astro Park Tallaght,Greenhills Road,(01) 459 9822,http://astropark.ie/,,,,,,,,,,,,,,,,Esri_Anonymous,2016-01-05T11:50:57.000Z,Esri_Anonymous,2016-01-05T11:53:28.000Z,No,Sports and Recreation Clubs,info@astropark.ie
-6.433146244805093,53.315499416828338,29219,Grange Castle Golf Club,"New Nangor Road, Clondalkin, Dublin 22, Co. Dublin, Ireland",(01) 4641043,http://www.grangecastlegc.com/,,,,,,,,,,,,,,,Golf Course,Esri_Anonymous,2016-04-27T09:53:32.000Z,Esri_Anonymous,2016-04-27T09:54:38.000Z,,Sports and Recreation Clubs,
-6.405905073103821,53.278904280339141,29220,Jobstown All Weather Pitch,"Jobstown, Tallaght, Dublin 24",087 6755474,,,,,,,,,,,,,,,,"Football, Soccer",Esri_Anonymous,2016-04-27T09:59:44.000Z,Esri_Anonymous,2016-04-29T14:33:11.000Z,,Sports and Recreation Clubs,
-6.477247943621157,53.303903311949497,29222,Peamount United fC,"Greenogue, Newcastle, Co. Dublin",,http://www.peamount.com/,,,,,,,,,,,,,,,"Soccer, Fitness, Sport Football",Esri_Anonymous,2016-04-27T11:15:05.000Z,Esri_Anonymous,2016-04-27T11:17:36.000Z,,Sports and Recreation Clubs,
-6.313941013305302,53.308267552600988,29224,Leinster Badminton Union,"Whitehall Road, Dublin 12",01 4505966,http://leinsterbadminton.com/,,,,,,,,,,,,,,,"Badminton, Sports, Fitness",Esri_Anonymous,2016-04-29T14:59:33.000Z,Esri_Anonymous,2016-04-29T15:01:01.000Z,,Sports and Recreation Clubs,
-6.455676785482468,53.264983811431158,29620,Eagles Rifle and Pistol Target Club,"Lugg Hill, Saggart, Co. Dublin",,http://www.eaglerifleandpistolclub.com/,,,,,,,,,,,,,,,Shooting,Esri_Anonymous,2016-04-27T10:45:16.000Z,Esri_Anonymous,2016-04-27T10:46:29.000Z,,Sports and Recreation Clubs,
-6.268067829349723,53.260057554720724,30021,Stackstown Golf Club,Stackstown Golf Club Kellystown Road Rathfarnham Dublin 16,1 494 1993,http://www.stackstowngolfclub.ie/,,,,,,,,,,,,,,,Golf,Esri_Anonymous,2016-04-27T10:19:09.000Z,Esri_Anonymous,2016-04-27T10:20:18.000Z,,Sports and Recreation Clubs,
-6.409599586356925,53.34133235348304,30023,South Dublin Football League,Ballyowen Park  Lucan  Co Dublin,01 4578020/25,http://www.sdfl.ie/,,,,,,,,,,,,,,,Soccer Football,Esri_Anonymous,2016-04-27T11:08:13.000Z,Esri_Anonymous,2016-04-27T11:10:48.000Z,,Sports and Recreation Clubs,
-6.386290277764703,53.273064395952055,30024,Sacred Heart Football Club,"Killinarden, Tallaght, Dublin 24",,,,,,,,,,,,,,,,,"All weather facility, soccer, football",Esri_Anonymous,2016-04-27T11:20:36.000Z,Esri_Anonymous,2016-04-27T11:21:48.000Z,,Sports and Recreation Clubs,
-6.388628752612981,53.290289569579315,30417,Glennane Hockey Club,"Glenanne Park, St. Marks Community School, Tallaght 24.",,http://www.glenannehockeyclub.com/,,,,,,,,,,,,,,,Hockey,Esri_Anonymous,2016-04-27T10:37:41.000Z,Esri_Anonymous,2016-04-27T10:39:17.000Z,,Sports and Recreation Clubs,
-6.325799182301568,53.296260199452611,4826,FAUGH'S GAA Club,"WELLINGTON LANE, DUBLIN 6W",4903566,http://faughs.ie/,,,,Yes,,Yes,,,,,Yes,,Yes,,GAA  CLUB,COMMUNITY,2015-06-15T15:39:47.000Z,Esri_Anonymous,2017-08-03T11:40:58.000Z,No,Sports and Recreation Clubs,secretary.faughshurling.dublin@gaa.ie
-6.273834578137076,53.263718762778552,29221,Kilmashogue Golf Club,"St. Columba's College, Whitechurch, Dublin 16",01 495 2237,http://www.kilmashoguegc.ie/,,,,,,,,,,,,,,,Golf,Esri_Anonymous,2016-04-27T10:56:45.000Z,Esri_Anonymous,2017-09-12T11:20:07.000Z,,Sports and Recreation Clubs,
-6.498175954849968,53.259951668289538,4860,BEECH PARK GOLF CLUB,"KILTEEL ROAD, JOHNSTOWN, RATHCOOLE, CO. DUBLIN",353 (0)1 458 0522,http://www.beechpark.ie/,,@,,,,,,,,,,,,,ACTIVITIES OF SPORT CLUBS,COMMUNITY,2015-06-15T15:39:47.000Z,Esri_Anonymous,2017-08-24T07:36:28.000Z,,Sports and Recreation Clubs,
-6.366792671178783,53.271654316750904,4884,AN POST SPORTS AND SOCIAL CLUB,"THE ANDY MOORE MEMORIAL SPORTS CLUB, KILTIPPER ROAD, DUBLIN 24",01 4626323,http://www.postal.ie/,,,Yes,,,Yes,,Yes,,,,,Yes,,SPORT CLUBS,COMMUNITY,2015-06-15T15:39:47.000Z,Esri_Anonymous,2017-09-13T12:22:33.000Z,No,Sports and Recreation Clubs,info@postal.ie
-6.401468121041084,53.337937504184936,4899,NEILSTOWN BOXING CLUB,"UNIT 12, NEILSTOWN ROAD, DUBLIN 22",Eircode D22Y9W9,,https://www.facebook.com/Neilstown-Boxing-Club-188181067860910/timeline/,,,,,,,,,,,,,,ACTIVITIES OF SPORT CLUBS,COMMUNITY,2015-06-15T15:39:47.000Z,Esri_Anonymous,2017-08-02T13:13:25.000Z,,Sports and Recreation Clubs,
